{
  "$schema": "https://json-schema.org/draft/2020-12/schema",
  "title": "Review",
  "type": "object",
  "properties": {
    "id": { "type": "string" },
    "review_type": { "type": "string" },
    "description": { "type": "string" },
    "review_date": { "type": "string", "format": "date" },
    "reviewer": { "type": "string" },
    "score": { "type": "number" },
    "review_status": { "type": "string" },
    "comments": { "type": "string" },
    "employee": { "$ref": "hr-partner-employee-ref-schema.json" }
  }
}
